repository,description,fork,created_at,updated_at,pushed_at,size,stargazers_count,watchers_count,language,has_issues,has_projects,has_downloads,has_wiki,has_pages,forks_count,open_issues_count,license,forks,open_issues,watchers,default_branch,subscribers_count,g4,rt
alpha-asp/Alpha,The Alpha solver for lazy-grounding Answer-Set Programming.,False,2016-07-08T10:52:13Z,2019-12-05T16:52:22Z,2019-12-13T21:17:00Z,29112,26,26,Java,True,True,True,True,False,3,52,"BSD 2-Clause ""Simplified"" License",3,52,26,master,7,2,12.0
altairmn/COOL-Compiler,Compiler for COOL. Uses ANTLR and LLVM Toolchain. Written in JAVA.,False,2016-02-07T14:13:04Z,2019-11-29T13:52:11Z,2016-02-07T14:13:57Z,75,33,33,Java,True,True,True,True,False,16,1,,16,1,33,master,5,2,18.0
ankor-io/ankor-framework,Ankor Framework,False,2014-02-27T13:53:58Z,2018-12-07T05:12:31Z,2018-10-17T09:17:19Z,20452,12,12,Java,True,True,True,True,False,2,3,Apache License 2.0,2,3,12,stable,6,1,1.0
antlr/antlr4-intellij-adaptor,A library to support the use of ANTLR grammars in jetbrains IDE plugins for building custom languages.,False,2015-11-16T17:33:04Z,2019-12-04T08:10:27Z,2019-02-21T21:46:38Z,333,96,96,Java,True,True,True,True,False,26,6,"BSD 2-Clause ""Simplified"" License",26,6,96,master,11,1,12.0
antlr/intellij-plugin-v4,"An intellij plugin for ANTLR v4 in Intellij 12.1, 13.X, 2018.2",False,2013-10-02T02:10:48Z,2019-12-14T14:22:07Z,2019-12-14T14:22:05Z,28199,264,264,Java,True,True,True,True,False,59,31,"BSD 3-Clause ""New"" or ""Revised"" License",59,31,264,master,21,6,33.0
antlr/jetbrains-plugin-sample,A sample plugin for jetbrains IDEs that uses an ANTLR grammar for a nontrivial custom language.,False,2015-12-15T20:44:14Z,2019-12-13T05:12:10Z,2019-02-14T20:54:01Z,3338,63,63,Java,True,True,True,True,False,19,1,"BSD 2-Clause ""Simplified"" License",19,1,63,master,10,1,1.0
antlr/jetbrains-plugin-st4,An intellij/jetbrains plugin for StringTemplate .st and .stg files,False,2015-11-09T17:27:04Z,2019-07-19T08:18:50Z,2019-01-18T11:14:32Z,2218,14,14,Java,True,True,True,True,False,7,0,"BSD 2-Clause ""Simplified"" License",7,0,14,master,4,6,17.0
antlr4ide/antlr4ide,ANTLR 4 IDE for Eclipse,False,2014-01-02T20:21:48Z,2019-12-12T21:19:16Z,2019-05-17T18:13:28Z,117699,188,188,Java,True,True,True,True,False,110,28,Eclipse Public License 1.0,110,28,188,master,35,11,1.0
antlrjavaparser/antlr-java-parser,Antlr Java Parser aims to create a Java parser using Antlr 4 grammar rules.,False,2012-12-28T19:03:36Z,2019-11-27T02:38:04Z,2015-07-21T20:29:58Z,3577,44,44,Java,True,True,True,True,False,13,6,GNU Lesser General Public License v3.0,13,6,44,master,4,2,10.0
aosp-mirror/platform_frameworks_support,,False,2012-04-10T04:06:44Z,2019-12-11T10:22:55Z,2019-11-16T07:56:40Z,354693,1552,1552,Java,False,False,True,False,False,646,0,Apache License 2.0,646,0,1552,androidx-master-dev,153,1,0.0
apache/apex-malhar,Mirror of Apache Apex malhar,False,2015-08-25T07:00:05Z,2019-11-13T07:49:29Z,2019-11-13T07:42:03Z,91989,132,132,Java,False,True,True,False,True,150,12,Apache License 2.0,150,12,132,master,28,1,4.0
apache/atlas,Apache Atlas,False,2017-07-22T07:00:08Z,2019-12-14T12:22:00Z,2019-12-14T05:39:59Z,54470,417,417,Java,False,True,True,False,False,265,30,Apache License 2.0,265,30,417,master,41,2,5.0
apache/beam,Apache Beam,False,2016-02-02T08:00:06Z,2019-12-14T03:01:14Z,2019-12-14T02:04:35Z,139890,3561,3561,Java,False,True,True,False,False,2207,153,Apache License 2.0,2207,153,3561,master,251,1,1.0
apache/directory-scimple,Apache Directory SCIMple,False,2018-06-18T19:04:19Z,2019-09-16T03:42:02Z,2018-12-14T04:19:46Z,1487,11,11,Java,False,False,True,False,False,4,2,Apache License 2.0,4,2,11,develop,16,5,6.0
apache/drill,Apache Drill,False,2012-09-05T07:00:26Z,2019-12-13T06:25:43Z,2019-12-14T12:02:49Z,84066,1316,1316,Java,False,True,True,False,True,778,74,Apache License 2.0,778,74,1316,master,170,3,4.0
apache/eagle,Mirror of Apache Eagle,False,2015-11-18T08:00:06Z,2019-12-13T04:10:20Z,2019-11-20T15:50:53Z,35666,384,384,Java,False,True,True,False,False,187,10,Apache License 2.0,187,10,384,master,62,1,7.0
apache/groovy,Mirror of Apache Groovy,False,2015-04-16T07:00:05Z,2019-12-13T22:22:16Z,2019-12-14T14:44:37Z,182734,3502,3502,Java,False,True,True,False,False,1362,14,Apache License 2.0,1362,14,3502,master,232,2,16.0
apache/hive,Apache Hive,False,2009-05-21T02:31:01Z,2019-12-14T12:12:28Z,2019-12-14T05:41:45Z,489863,2907,2907,Java,False,True,True,False,False,2800,362,Apache License 2.0,2800,362,2907,master,319,1,11.0
apache/incubator-druid,Apache Druid (Incubating) - Column oriented distributed data store ideal for powering interactive applications,False,2012-10-23T19:08:07Z,2019-12-14T02:12:21Z,2019-12-14T00:54:19Z,197864,8952,8952,Java,True,True,True,True,False,2301,910,Apache License 2.0,2301,910,8952,master,630,2,3.0
apache/incubator-pinot,Apache Pinot (Incubating) - A realtime distributed OLAP datastore,False,2014-05-19T23:27:48Z,2019-12-13T22:53:07Z,2019-12-14T00:43:50Z,180520,2413,2413,Java,True,True,True,True,False,469,323,Apache License 2.0,469,323,2413,master,200,1,5.0
apache/incubator-tajo,Mirror of Apache Tajo,False,2014-03-21T07:00:07Z,2019-07-11T14:15:59Z,2018-12-10T16:03:41Z,7327,23,23,Java,False,True,True,False,False,15,0,Apache License 2.0,15,0,23,master,7,4,7.0
apache/incubator-tuweni,Apache Tuweni,False,2019-03-29T19:02:36Z,2019-12-07T00:29:36Z,2019-12-07T00:28:28Z,42330,35,35,Java,False,False,True,False,False,29,0,Apache License 2.0,29,0,35,master,13,2,8.0
apache/lucene-solr,Apache Lucene and Solr open-source search software,False,2016-01-23T08:00:06Z,2019-12-14T13:47:30Z,2019-12-14T09:23:45Z,494081,3129,3129,Java,False,True,True,False,False,2194,234,,2194,234,3129,master,307,1,6.0
apache/metron,Apache Metron,False,2015-12-08T08:00:05Z,2019-12-14T00:29:52Z,2019-12-13T23:18:44Z,97282,707,707,Java,False,True,True,False,False,471,24,Apache License 2.0,471,24,707,master,107,2,15.0
apache/netbeans,Apache NetBeans,False,2017-09-01T07:00:11Z,2019-12-13T20:47:00Z,2019-12-14T10:20:53Z,178429,1219,1219,Java,False,True,True,False,False,469,71,Apache License 2.0,469,71,1219,master,145,1,18.0
apache/plc4x,Apache PLC4X,False,2017-12-20T08:00:09Z,2019-12-13T12:46:42Z,2019-12-14T03:38:54Z,110113,147,147,Java,False,True,True,False,False,79,5,Apache License 2.0,79,5,147,develop,33,3,2.0
apache/skywalking,"APM, Application Performance Monitoring System",False,2015-11-07T03:30:36Z,2019-12-14T14:33:02Z,2019-12-14T14:30:14Z,147054,11657,11657,Java,True,False,True,False,False,3394,85,Apache License 2.0,3394,85,11657,master,733,2,1.0
apache/syncope,Apache Syncope,False,2014-10-23T07:00:10Z,2019-12-13T14:47:24Z,2019-12-13T14:47:21Z,50068,99,99,Java,False,True,True,False,False,99,2,Apache License 2.0,99,2,99,master,30,1,2.0
apache/systemml,Mirror of Apache SystemML,False,2015-11-10T08:00:06Z,2019-11-30T21:47:11Z,2019-08-09T14:20:36Z,210926,786,786,Java,False,True,True,False,True,308,24,Apache License 2.0,308,24,786,master,103,2,23.0
apache/tajo,Mirror of Apache Tajo,False,2014-03-21T07:00:07Z,2019-09-08T13:14:52Z,2019-09-11T07:16:21Z,30701,118,118,Java,False,True,True,False,False,104,34,Apache License 2.0,104,34,118,master,21,2,4.0
apollographql/apollo-android,":pager: A strongly-typed, caching GraphQL client for Android and the JVM",False,2016-09-28T14:03:30Z,2019-12-14T12:43:28Z,2019-12-14T12:27:57Z,143875,1995,1995,Java,True,False,True,True,True,379,93,MIT License,379,93,1995,master,92,1,0.0
arcus-smart-home/arcusplatform,Java Based Arcus Platform and Agent Components,False,2019-01-29T16:49:10Z,2019-12-13T15:21:21Z,2019-12-11T02:30:56Z,416873,61,61,Java,True,True,True,True,False,41,20,Apache License 2.0,41,20,61,master,28,4,3.0
artist-project/ARTIST,Public repository containing ARTIST tools and artefacts.,False,2014-05-20T09:50:21Z,2019-11-28T01:10:20Z,2015-10-22T08:05:38Z,621269,11,11,Java,True,True,True,True,False,10,0,,10,0,11,master,38,1,0.0
asciidoctor/asciidoc-grammar-prototype,:no_entry: ARCHIVED: An experiment to create of a formal grammar for the AsciiDoc markup language. Work is being continued at https://github.com/Mogztter/asciidoctor-inline-parser.,False,2015-04-02T10:42:12Z,2019-10-31T09:48:25Z,2018-11-24T21:56:12Z,108,12,12,Java,True,True,True,False,False,6,4,MIT License,6,4,12,master,13,1,1.0
atlascommunity/jira-plugins-groovy,Jira Groovy plugin,False,2018-04-06T09:57:26Z,2019-12-08T12:45:52Z,2019-12-08T12:47:56Z,2550,29,29,Java,True,True,True,True,False,18,6,"BSD 2-Clause ""Simplified"" License",18,6,29,jira8,15,3,2.0
babyfish-ct/babyfish,,False,2015-10-17T13:17:31Z,2019-05-06T12:19:37Z,2017-10-02T18:53:52Z,5105,49,49,Java,True,True,True,True,False,23,1,,23,1,49,master,16,1,1.0
ballerina-platform/ballerina-lang,The Ballerina Programming Language,False,2016-11-16T14:58:44Z,2019-12-13T14:22:43Z,2019-12-14T14:56:38Z,461628,2245,2245,Java,True,True,True,True,False,505,1094,Other,505,1094,2245,master,150,5,63.0
bbejeck/sql-for-lucene,Sql Parser written in Antlr4 for Lucene ,False,2015-03-29T23:57:48Z,2019-11-21T08:53:56Z,2018-04-28T12:58:15Z,7067,35,35,Java,True,True,True,True,False,15,1,Apache License 2.0,15,1,35,master,6,1,9.0
bitnine-oss/octopus,,False,2015-04-02T08:20:27Z,2019-05-22T04:58:56Z,2016-01-29T01:15:20Z,2216,13,13,Java,True,True,True,True,True,8,1,Apache License 2.0,8,1,13,master,8,1,2.0
bkiers/Liqp,An ANTLR based 'Liquid Template' parser and rendering engine.,False,2012-02-27T20:57:32Z,2019-12-06T17:58:39Z,2019-11-25T11:38:36Z,10023,93,93,Java,True,True,True,True,False,60,8,Other,60,8,93,master,16,2,82.0
bkiers/Mu,A small demonstration how to use ANTLR 4's visitor feature.,False,2013-03-25T12:43:31Z,2019-07-28T22:29:25Z,2014-09-02T21:25:10Z,1239,55,55,Java,True,True,True,True,False,24,0,,24,0,55,master,10,1,2.0
bkiers/ecmascript-parser,An ANTLR4 grammar for ECMAScript 5.1,False,2014-04-22T09:22:33Z,2018-10-11T12:53:11Z,2017-07-13T08:06:28Z,53,12,12,Java,True,True,True,True,False,2,0,MIT License,2,0,12,master,3,1,4.0
bkiers/pcre-parser,An ANTLR 4 grammar for PCRE,False,2014-03-21T09:02:44Z,2019-06-06T13:41:07Z,2018-11-19T11:37:25Z,22,22,22,ANTLR,True,True,True,True,False,3,0,Other,3,0,22,master,2,1,2.0
bkiers/rrd-antlr4,Railroad Diagrams for ANTLR 4 grammar rules.,False,2014-03-11T19:29:07Z,2019-11-27T08:38:33Z,2018-12-12T05:54:53Z,13871,68,68,ANTLR,True,True,True,True,False,16,0,Other,16,0,68,master,5,5,2.0
bkiers/tiny-language-antlr4,Tiny Language with ANTLR 4,False,2013-10-22T12:48:15Z,2019-12-01T10:36:16Z,2019-12-05T22:21:55Z,36,122,122,Java,True,True,True,True,False,35,1,The Unlicense,35,1,122,master,13,1,5.0
blindpirate/the-definitive-antlr4-reference-code,"A copy of code in ""The Definitive ANTLR 4 Reference"" for ANTLR 4.6",False,2016-12-27T03:45:43Z,2019-11-09T16:20:18Z,2017-05-10T06:43:21Z,7,16,16,ANTLR,True,True,True,True,False,5,0,,5,0,16,master,1,5,0.0
bohnman/squiggly,"The Squiggly Filter is a Jackson JSON PropertyFilter, which selects properties of an object/list/map using a subset of the Facebook Graph API filtering syntax.",False,2016-10-16T02:27:08Z,2019-12-06T08:56:11Z,2019-11-13T03:21:45Z,1265,160,160,Java,True,True,True,True,False,27,25,"BSD 3-Clause ""New"" or ""Revised"" License",27,25,160,master,19,1,2.0
boothen/Json-Eclipse-Plugin,A fork from the json editor on sourceforge,False,2012-07-26T20:21:19Z,2019-11-15T07:41:18Z,2019-03-03T12:22:52Z,3113,52,52,Java,True,True,True,False,True,14,9,Eclipse Public License 1.0,14,9,52,master,8,2,30.0
bootsrc/apidoc4j,APIDOC java implementation via ANTLR,False,2018-01-10T14:30:08Z,2019-04-12T08:36:13Z,2018-01-14T09:58:36Z,86,32,32,Java,True,True,True,True,False,2,0,,2,0,32,master,1,4,12.0
bozsahin/ceng444,METU Computer science introductory compiler course: Language Processors,False,2018-08-19T14:39:11Z,2019-12-09T07:52:26Z,2019-12-09T07:52:24Z,86087,19,19,Java,True,True,True,True,False,2,0,,2,0,19,master,6,3,12.0
brettwooldridge/jet,Swift-to-JVM bytecode compiler.,False,2014-06-03T04:08:43Z,2019-08-13T15:43:00Z,2014-08-17T13:50:02Z,204,47,47,ANTLR,True,True,True,True,False,3,1,Apache License 2.0,3,1,47,master,8,8,0.0
brunocvcunha/mdmlang,🔄  Natural Transformation Language for Java,False,2015-07-06T18:58:35Z,2019-08-29T17:36:07Z,2016-07-01T05:34:24Z,51,13,13,Java,True,True,True,True,True,0,0,Apache License 2.0,0,0,13,master,1,1,1.0
btrplace/scheduler,BtrPlace is a virtual machine scheduler. You can specialized it safely through independent constraints to make it support what match your expectations.,False,2013-02-25T10:14:20Z,2019-12-02T08:09:56Z,2019-12-02T08:15:20Z,91770,50,50,Java,True,True,True,True,False,11,24,GNU Lesser General Public License v3.0,11,24,50,master,5,1,3.0
buildpal/buildpal-platform,A docker native light-weight continuous integration server,False,2017-12-30T05:54:42Z,2019-09-06T07:47:37Z,2018-01-27T23:47:41Z,224,18,18,Java,True,True,True,True,False,6,0,,6,0,18,master,7,1,1.0
byuccl/RapidSmith2,"RapidSmith2 - the Vivado successor to RapidSmith. Released Jan 4, 2017.",False,2016-07-07T21:43:03Z,2019-08-26T22:46:34Z,2019-12-03T02:47:35Z,529634,17,17,Java,True,True,True,True,True,6,47,Other,6,47,17,master,9,3,5.0
camertron/SQLParser,ANTLR4-based SQL Parser extracted from Apache Tajo,False,2014-03-09T22:54:50Z,2019-08-12T16:15:20Z,2019-08-12T16:15:18Z,1373,13,13,Java,True,True,True,True,False,8,0,,8,0,13,master,5,2,5.0
carrotsearch/hppc,High Performance Primitive Collections for Java,False,2011-02-22T15:14:20Z,2019-12-11T16:10:10Z,2019-05-14T07:15:45Z,45432,636,636,Java,False,True,True,True,True,103,0,Apache License 2.0,103,0,636,master,62,2,3.0
castlemock/castlemock,Castle Mock is a web application that provides the functionality to mock out RESTful APIs and SOAP web services. ,False,2016-07-17T13:57:57Z,2019-11-27T12:07:21Z,2019-11-26T21:43:11Z,12770,75,75,Java,True,True,True,True,False,22,30,Other,22,30,75,master,18,1,9.0
cesquivias/mumbler,My experimental programming language using Truffle,False,2014-09-29T12:51:59Z,2019-12-11T16:29:30Z,2016-09-28T06:11:05Z,308,79,79,Java,True,True,True,True,False,11,1,GNU General Public License v3.0,11,1,79,master,6,1,3.0
cfparser/cfparser,testcfmlparser,False,2014-08-11T02:42:47Z,2019-11-18T03:12:00Z,2019-11-20T02:29:35Z,9656,17,17,Java,True,True,True,True,False,11,5,,11,5,17,master,11,4,76.0
chanedi/QuickProject,,False,2014-02-10T12:59:39Z,2019-05-27T06:52:50Z,2016-12-30T10:50:31Z,474,28,28,Java,True,True,True,True,False,22,2,Apache License 2.0,22,2,28,master,12,2,6.0
charite/jannovar,Annotation of VCF variants with functional impact and from databases (executable+library),False,2013-07-07T12:57:20Z,2019-11-26T17:26:19Z,2019-11-15T12:57:04Z,24053,32,32,Java,True,True,True,False,True,31,24,Other,31,24,32,master,11,2,9.0
checkstyle/checkstyle,"Checkstyle is a development tool to help programmers write Java code that adheres to a coding standard. By default it supports the Google Java Style Guide and Sun Code Conventions, but is highly configurable. It can be invoked with an ANT task and a command line program.",False,2013-08-31T02:05:05Z,2019-12-14T08:18:08Z,2019-12-14T14:33:16Z,65753,4978,4978,Java,True,True,True,True,False,7105,508,Other,7105,508,4978,master,211,1,11.0
claw-project/claw-compiler,CLAW Compiler for Performance Portability,False,2016-01-18T08:23:03Z,2019-12-09T15:27:16Z,2019-12-09T15:27:47Z,7854,30,30,Java,True,True,True,True,False,10,18,"BSD 2-Clause ""Simplified"" License",10,18,30,master,4,2,1.0
clnhlzmn/CopperKitten,An exercise in programming language design and implementation.,False,2018-05-03T17:33:39Z,2019-11-10T21:43:05Z,2019-08-26T14:03:17Z,36793,20,20,Java,True,True,True,True,False,0,0,,0,0,20,master,1,2,12.0
clouditor/clouditor,The Clouditor is a tool to support continuous cloud assurance. Developed by Fraunhofer AISEC.,False,2019-05-13T09:21:40Z,2019-11-22T14:53:09Z,2019-12-10T09:41:48Z,2679,17,17,Java,True,True,True,False,False,5,24,Apache License 2.0,5,24,17,master,5,1,1.0
cmu-able/rainbow,Rainbow self-adaptive framework ,False,2017-11-01T16:23:21Z,2019-11-30T01:48:48Z,2019-12-13T20:22:52Z,129533,19,19,Java,True,True,True,True,True,14,7,Other,14,7,19,master,11,3,15.0
codelion/gramtest,GramTest: A tool for Grammar based Test case generation,False,2015-04-20T05:59:37Z,2019-12-10T13:41:46Z,2018-05-20T02:35:32Z,93,64,64,Java,True,True,True,True,False,11,3,Apache License 2.0,11,3,64,master,4,1,4.0
codice/alliance,,False,2016-02-29T16:10:33Z,2019-12-11T16:18:26Z,2019-12-11T16:18:39Z,87238,32,32,Java,True,True,True,False,False,89,12,Other,89,12,32,master,32,1,1.0
collectionspace/services,The CollectionSpace service layer with a RESTful API,False,2012-02-16T15:20:04Z,2019-11-05T23:52:11Z,2019-12-13T01:07:27Z,521627,19,19,Java,True,True,True,True,False,35,1,Other,35,1,19,master,8,1,1.0
colomoto/bioLQM,toolkit for the manipulation and analysis of Logical Qualitative Models of biological regulatory networks,False,2012-07-05T09:27:10Z,2019-12-13T09:29:39Z,2019-10-01T11:17:09Z,1429,11,11,Java,True,True,True,True,True,8,6,GNU Lesser General Public License v3.0,8,6,11,master,8,7,8.0
confluentinc/ksql,The event streaming database purpose-built for stream processing applications,False,2016-09-27T21:30:15Z,2019-12-14T14:08:07Z,2019-12-13T23:38:59Z,39348,3037,3037,Java,True,True,True,True,False,575,629,Other,575,629,3037,master,307,1,15.0
cqframework/clinical_quality_language,Clinical Quality Language (CQL) is an HL7 specification for the expression of clinical knowledge that can be used within both the Clinical Decision Support (CDS) and Clinical Quality Measurement (CQM) domains. This repository contains complementary tooling in support of that specification.,False,2014-08-26T17:30:05Z,2019-12-09T10:44:51Z,2019-12-05T23:03:40Z,15525,124,124,Java,True,True,True,True,False,69,48,Apache License 2.0,69,48,124,master,45,3,16.0
crate/crate,CrateDB is a distributed SQL database that makes it simple to store and analyze massive amounts of machine data in real-time.,False,2013-04-10T09:17:16Z,2019-12-13T21:33:56Z,2019-12-13T10:39:15Z,97010,2620,2620,Java,True,True,True,False,False,361,100,Apache License 2.0,361,100,2620,master,166,1,5.0
crossminer/scava,,False,2017-12-11T15:56:15Z,2019-12-05T12:26:32Z,2019-12-13T20:52:49Z,1903008,14,14,Java,True,True,True,True,False,11,77,Eclipse Public License 2.0,11,77,14,master,14,8,13.0
crossmob/CrossMobile,"  Create native iOS, Android, Windows Phone and Desktop applications in Java. Write it once, and produce sophisticated multiplatform applications.",False,2019-05-01T20:25:41Z,2019-12-04T21:26:02Z,2019-12-04T21:26:00Z,18443,23,23,Java,True,True,True,True,False,6,0,Other,6,0,23,master,3,2,15.0
cyberthinkers/typescript-to-scala-js-facade,This tool will create JavaScript facades for Scala.js from typescript ambient declarations. ,False,2016-06-30T19:22:52Z,2018-04-25T22:04:15Z,2018-02-04T21:51:06Z,178,19,19,Java,True,True,True,True,False,1,0,Apache License 2.0,1,0,19,master,4,1,10.0
cytosm/cytosm,OpenCypher to SQL Mapper,False,2016-12-12T17:30:55Z,2019-11-28T15:06:03Z,2018-10-09T20:16:51Z,1250,37,37,Java,True,True,True,True,False,12,5,Other,12,5,37,master,7,2,2.0
daimor/NBStudio,Alternative IDE/Studio for InterSystems Caché on Netbeans Platform,False,2013-09-20T18:21:09Z,2019-11-28T10:38:37Z,2015-07-17T20:16:58Z,19369,23,23,Java,True,True,True,True,True,6,5,MIT License,6,5,23,master,11,6,10.0
dapeng-soa/dapeng-soa,"A lightweight, high performance micro-service framework",False,2018-01-08T03:58:38Z,2019-11-26T11:52:47Z,2019-12-11T06:23:05Z,9893,72,72,Java,True,True,True,True,False,22,3,Apache License 2.0,22,3,72,master,15,1,0.0
daqcri/rheem,Rheem Project,False,2016-06-09T09:15:18Z,2018-11-02T07:01:30Z,2018-08-30T12:47:43Z,143140,16,16,Java,True,True,True,True,True,8,1,Apache License 2.0,8,1,16,master,11,1,1.0
data-integrations/wrangler,Wrangler Transform: A DMD system for transforming Big Data,False,2016-11-27T19:01:32Z,2019-12-13T18:33:07Z,2019-12-14T08:44:41Z,31466,21,21,Java,False,False,True,True,False,18,4,Apache License 2.0,18,4,21,release/4.1,5,1,3.0
datasphere-oss/datasphere-service,an open source dataworks platform ,False,2019-08-22T11:58:35Z,2019-12-07T05:12:33Z,2019-12-07T05:12:31Z,7000,15,15,Java,True,True,True,True,False,4,2,,4,2,15,master,4,3,3.0
datathings/greycat,"GreyCat - Data Analytics, Temporal data, What-if, Live machine learning",False,2017-02-03T11:02:04Z,2019-12-13T21:01:47Z,2019-11-20T01:35:36Z,68340,81,81,Java,True,True,True,True,True,20,49,Apache License 2.0,20,49,81,master,19,1,1.0
dbiir/rainbow,A data layout optimization framework for wide tables stored on HDFS. See rainbow's webpage ,False,2017-05-04T10:14:09Z,2019-12-06T14:56:35Z,2018-06-19T07:47:25Z,68337,61,61,Java,True,True,True,True,True,40,2,Apache License 2.0,40,2,61,master,5,2,8.0
debezium/debezium,Change data capture for a variety of databases. https://debezium.io Please log issues in our JIRA at https://issues.jboss.org/projects/DBZ/issues,False,2016-01-22T20:17:05Z,2019-12-14T10:35:52Z,2019-12-13T17:28:59Z,10146,2430,2430,Java,False,True,True,True,False,644,12,Other,644,12,2430,master,145,4,13.0
defano/wyldcard,A clone of Apple's HyperCard and HyperTalk scripting language.,False,2015-05-08T02:46:50Z,2019-11-24T02:15:14Z,2019-07-05T13:37:48Z,5631,37,37,Java,True,True,True,True,False,2,3,MIT License,2,3,37,master,3,1,211.0
developeron29/PLSQLParser,A PLSQL parser built using Java and ANTLR4 ,False,2014-02-18T15:54:46Z,2019-07-14T14:18:02Z,2019-03-22T16:53:56Z,660,20,20,Java,True,True,True,True,False,16,1,MIT License,16,1,20,master,7,1,4.0
devinfrench/runelite-ext,RuneLite Extended - Modified Old School RuneScape RuneLite Client,False,2018-05-24T20:15:46Z,2019-12-03T23:10:14Z,2019-11-02T09:26:27Z,16710,11,11,Java,True,True,True,True,False,16,4,"BSD 2-Clause ""Simplified"" License",16,4,11,master,4,1,2.0
dhis2/dhis2-core,DHIS 2 Core. Written in Java. Contains the service layer and Web API.,False,2016-08-30T12:57:05Z,2019-12-12T09:34:26Z,2019-12-14T11:16:32Z,77330,147,147,Java,False,False,True,True,False,162,33,"BSD 3-Clause ""New"" or ""Revised"" License",162,33,147,master,49,1,4.0
diqube/diqube,"diqube is a fast, distributed, in-memory column-store which enables you to analyze large amounts of read-only data easily",False,2015-07-10T13:34:28Z,2017-09-13T16:17:52Z,2019-12-09T17:15:54Z,3178,17,17,Java,True,True,True,True,False,1,63,GNU Affero General Public License v3.0,1,63,17,master,4,1,7.0
dma-ais/AisLib,DMA AisLib - Java library for handling AIS messages,False,2012-11-01T12:38:22Z,2019-11-30T09:37:59Z,2019-11-13T08:31:56Z,3431,90,90,Java,True,True,True,True,False,64,12,Other,64,12,90,master,30,1,7.0
donatellosantoro/Llunatic,The Llunatic Mapping and Cleaning Chase Engine,False,2014-07-27T16:29:19Z,2019-09-22T22:30:54Z,2019-04-29T16:41:56Z,102827,19,19,Java,True,True,True,True,False,6,0,GNU General Public License v3.0,6,0,19,master,8,3,15.0
doov-io/doov,dOOv (Domain Object Oriented Validation) a fluent API for type-safe bean validation and mapping,False,2018-08-13T13:47:00Z,2019-12-13T08:45:39Z,2019-11-05T13:30:52Z,9618,45,45,Java,True,True,True,True,True,6,0,Apache License 2.0,6,0,45,master,14,4,13.0
dst-project/dst,A distributed key-value in-memory store system with table concept.,False,2019-05-22T14:45:00Z,2019-12-14T05:33:11Z,2019-12-14T15:26:29Z,510,24,24,Java,True,True,True,True,True,13,52,,13,52,24,master,5,1,3.0
dungba88/libra,"Java Predicate, supports SQL-like syntax",False,2017-11-10T20:21:51Z,2019-11-08T09:55:21Z,2019-08-15T07:57:24Z,554,22,22,Java,True,True,True,True,False,0,0,MIT License,0,0,22,master,5,4,2.0
eBay/Eagle,"This codebase is retained for historical interest only, please visit Apache Incubator Repository for latest one",False,2015-10-16T21:36:50Z,2019-08-18T16:53:32Z,2015-11-21T07:36:37Z,4142,193,193,Java,False,True,True,True,False,59,0,Apache License 2.0,59,0,193,master,42,1,7.0
ebean-orm/ebean,Ebean ORM,False,2012-09-13T11:49:56Z,2019-12-14T04:38:49Z,2019-12-13T01:21:00Z,20401,979,979,Java,True,False,True,True,True,219,10,Other,219,10,979,master,77,1,7.0
eclecticlogic/stepper,Stepper allows you to write AWS Step Functions using a higher level programmatic language.,False,2014-12-20T21:51:28Z,2019-09-12T08:09:59Z,2019-07-27T12:40:24Z,353,12,12,Java,True,True,True,True,True,2,0,Apache License 2.0,2,0,12,master,1,1,8.0
eclipse/jnosql,Eclipse JNoSQL is a framework which has the goal to help Java developers to create Jakarta EE applications with NoSQL.,False,2016-07-14T21:58:40Z,2019-12-11T14:15:09Z,2019-12-07T19:42:50Z,5384,124,124,Java,True,True,True,False,False,37,15,Other,37,15,124,master,36,2,19.0
eclipse/titan.EclipsePlug-ins,,False,2015-01-12T21:13:36Z,2019-12-13T17:04:20Z,2019-12-14T07:33:18Z,126388,17,17,Java,True,True,True,True,False,36,0,Other,36,0,17,master,11,20,92.0
eclipse/winery,Eclipse Winery project,False,2015-09-17T00:31:44Z,2019-12-12T12:22:18Z,2019-12-13T17:12:03Z,27334,34,34,Java,True,True,True,True,True,38,38,Other,38,38,34,master,9,1,6.0
ehrbase/ehrbase,,False,2019-10-08T08:54:57Z,2019-12-13T09:21:14Z,2019-12-13T12:32:33Z,9676,13,13,Java,True,True,True,True,False,9,21,Other,9,21,13,develop,7,1,11.0
elastic/elasticsearch,"Open Source, Distributed, RESTful Search Engine",False,2010-02-08T13:20:56Z,2019-12-14T11:51:15Z,2019-12-14T13:46:48Z,692069,45969,45969,Java,True,True,True,False,False,15539,2321,Other,15539,2321,45969,master,2799,3,23.0
er-lang/er,"er ~ emergency room (a BEAM language ""improving"" on Erlang)",False,2013-10-29T11:42:40Z,2019-01-12T18:29:25Z,2019-01-05T19:56:58Z,24607,31,31,ANTLR,True,False,True,False,False,4,0,,4,0,31,master,2,2,0.0
ethereumj/ethereumj,Ethereum pure Java implementation. ,False,2014-09-26T14:47:51Z,2019-12-03T18:50:22Z,2014-11-03T17:12:13Z,14209,25,25,Java,True,True,True,False,False,21,2,MIT License,21,2,25,master,5,1,4.0
