repository,description,fork,created_at,updated_at,pushed_at,size,stargazers_count,watchers_count,language,has_issues,has_projects,has_downloads,has_wiki,has_pages,forks_count,open_issues_count,license,forks,open_issues,watchers,default_branch,subscribers_count,g4,rt
eugenp/tutorials,"Just Announced - ""Learn Spring Security OAuth"": ",False,2013-04-29T18:26:36Z,2019-12-14T14:51:38Z,2019-12-14T15:32:47Z,250098,18549,18549,Java,True,True,True,True,False,28444,60,MIT License,28444,60,18549,master,1356,2,3.0
exense/step,Scalable Test Execution Platform,False,2016-06-30T21:08:29Z,2019-12-13T16:22:54Z,2019-12-13T16:22:52Z,131910,12,12,Java,False,True,True,True,False,0,1,GNU Affero General Public License v3.0,0,1,12,master,7,1,8.0
eyob--/j2swift,A java to swift converter,False,2015-08-10T18:17:53Z,2019-12-03T12:55:52Z,2015-08-23T06:10:36Z,316,17,17,Java,True,True,True,True,False,4,1,,4,1,17,master,3,1,6.0
fang-yan-peng/badger,轻量级单表操作dao框架，支持分库分表,False,2019-02-13T07:04:45Z,2019-09-30T07:52:51Z,2019-05-13T13:56:11Z,206,13,13,Java,True,True,True,True,False,3,1,,3,1,13,master,1,1,6.0
fbacchella/LogHub,,False,2014-08-07T15:10:10Z,2019-12-10T14:17:13Z,2019-12-10T14:17:10Z,33309,35,35,Java,True,True,True,True,False,4,5,Other,4,5,35,master,10,1,9.0
fizzed/rocker,"Java 8 optimized, memory efficient, speedy template engine producing statically typed, plain java objects",False,2015-03-17T23:52:08Z,2019-12-11T06:44:59Z,2019-12-07T01:02:57Z,2672,520,520,Java,True,True,True,True,False,58,40,,58,40,520,master,29,4,4.0
flashpixx/RRD-ANTLR4,AntLR 4 Railroad Diagram Generator,False,2016-02-23T23:38:48Z,2019-11-27T08:38:47Z,2017-05-24T14:52:27Z,29527,11,11,Java,False,True,True,False,True,4,0,GNU Lesser General Public License v3.0,4,0,11,master,5,6,4.0
fooock/robots.txt,":robot: robots.txt as a service. Crawls robots.txt files, downloads and parses them to check rules through an API",False,2019-06-16T14:38:50Z,2019-12-14T00:00:59Z,2019-12-14T00:00:57Z,1988,13,13,Java,True,False,True,False,False,1,7,GNU General Public License v3.0,1,7,13,master,2,2,0.0
ftomassetti/antlr-plus,A complement to ANTLR to get a model from your AST and transform it,False,2016-05-24T19:19:50Z,2018-12-14T12:20:04Z,2019-12-03T15:47:24Z,228,13,13,ANTLR,True,True,True,True,False,3,0,,3,0,13,master,3,5,13.0
ftomassetti/python-ast,Python parser built using ANTLR,False,2016-02-20T09:01:41Z,2019-10-24T16:09:54Z,2016-02-21T16:04:08Z,21,33,33,ANTLR,True,True,True,True,False,12,2,Apache License 2.0,12,2,33,master,3,1,2.0
ftomassetti/turin-programming-language,A static language for the JVM with sensible defaults,False,2015-08-28T13:05:10Z,2019-10-16T12:16:36Z,2015-11-27T15:06:55Z,2103,63,63,Java,True,True,True,True,False,9,39,Apache License 2.0,9,39,63,master,6,2,3.0
gburdell/parser,Derived from https://sourceforge.net/projects/v2kparse,False,2011-12-14T17:28:43Z,2019-11-28T07:15:39Z,2015-09-10T23:23:23Z,6861,43,43,Java,True,True,True,True,False,12,0,,12,0,43,master,15,1,1.0
georocket/georocket,🚀 GeoRocket - A high-performance data store for geospatial files.,False,2016-05-06T11:34:34Z,2019-12-03T15:52:08Z,2019-12-03T15:52:06Z,1968,39,39,Java,True,True,True,False,False,18,1,Apache License 2.0,18,1,39,master,7,1,2.0
geosolutions-it/jai-ext,Java Advanced Imaging Open Source Replacement Wannabe,False,2012-09-25T08:47:49Z,2019-10-08T07:24:03Z,2019-10-07T08:22:49Z,24022,55,55,Java,True,False,True,True,True,30,41,Apache License 2.0,30,41,55,master,13,1,22.0
goldmansachs/jdmn,A Java implementation of DMN,False,2018-01-22T15:49:55Z,2019-12-09T00:59:04Z,2019-11-16T18:26:52Z,4210,57,57,Java,True,True,True,True,True,20,0,Apache License 2.0,20,0,57,master,18,8,6.0
google/graphicsfuzz,A testing framework for automatically finding and simplifying bugs in graphics shader compilers.,False,2018-09-24T16:31:05Z,2019-12-13T16:19:43Z,2019-12-13T16:22:09Z,8705,353,353,Java,True,True,True,True,False,53,107,Apache License 2.0,53,107,353,master,19,1,3.0
graalvm/simplelanguage,A simple example language built using the Truffle API.,False,2015-04-30T22:58:08Z,2019-12-12T12:17:23Z,2019-11-26T14:56:20Z,1304,289,289,Java,True,True,True,False,False,103,18,Universal Permissive License v1.0,103,18,289,master,34,1,3.0
graalvm/sulong,Obsolete repository. Moved to oracle/graal.,False,2016-01-18T10:12:52Z,2019-11-06T04:02:06Z,2018-12-05T11:05:28Z,11474,618,618,Java,True,True,True,True,False,61,10,Other,61,10,618,master,54,1,2.0
graknlabs/graql,Graql: Grakn Query Language,False,2019-02-16T23:01:20Z,2019-12-09T14:36:56Z,2019-12-09T14:36:53Z,379,39,39,Java,True,False,True,True,False,15,39,GNU Affero General Public License v3.0,15,39,39,master,9,1,2.0
graphql-java/graphql-java,GraphQL Java implementation,False,2015-07-06T06:52:20Z,2019-12-14T08:34:12Z,2019-12-13T23:50:32Z,5929,3885,3885,Java,True,True,True,True,False,700,96,MIT License,700,96,3885,master,220,4,4.0
graphql-java/nadel,A GraphQL DSL and execution engine for distributed schemas,False,2018-02-13T06:24:16Z,2019-12-13T03:51:12Z,2019-12-13T03:51:09Z,1058,48,48,Java,True,True,True,True,False,6,5,MIT License,6,5,48,master,15,1,2.0
gretard/sonar-tsql-plugin,T-SQL language plugin for SonarQube,False,2016-07-11T16:54:31Z,2019-10-11T15:38:37Z,2019-10-11T15:38:35Z,2049,42,42,Java,True,True,True,True,False,8,0,GNU General Public License v3.0,8,0,42,master,6,1,30.0
groovy/groovy-eclipse,Groovy-Eclipse,False,2012-05-03T11:11:18Z,2019-12-13T23:59:39Z,2019-12-13T23:59:36Z,947026,528,528,Java,True,True,True,True,False,170,62,,170,62,528,master,53,2,4.0
grosenberg/fluentmark,FluentMark -- Eclipse editor for Markdown content,False,2016-12-18T01:12:43Z,2019-10-05T15:40:23Z,2019-07-18T12:47:04Z,1797,19,19,Java,True,True,True,True,False,9,15,Eclipse Public License 1.0,9,15,19,master,4,2,21.0
groupon/monsoon,An extensible monitor system that checks java processes and exposes metrics based on them.,False,2016-06-22T19:08:44Z,2019-11-21T01:34:57Z,2017-12-19T02:34:58Z,4853,27,27,Java,True,True,True,True,False,5,2,"BSD 3-Clause ""New"" or ""Revised"" License",5,2,27,master,5,13,6.0
guidosalva/reactive-inspector,Eclipse plugin for debugging reactive programming,False,2014-10-29T21:33:33Z,2019-06-16T20:17:25Z,2018-10-30T16:12:02Z,69833,20,20,Java,True,True,True,True,True,3,0,,3,0,20,master,8,1,8.0
gvlasov/inflectible,Template engine for natural languages that allows using grammatically appropriate word forms,False,2013-12-17T00:44:42Z,2019-10-11T19:56:53Z,2018-08-03T04:03:04Z,656,81,81,Java,True,True,True,True,False,2,21,MIT License,2,21,81,master,8,6,11.0
haku/dlnatoad,Minimal DLNA media content server,False,2013-01-26T18:29:57Z,2019-11-03T13:16:29Z,2019-07-09T17:50:57Z,257,20,20,Java,True,True,True,True,False,9,6,,9,6,20,master,7,1,1.0
harbby/sylph,Stream computing platform for bigdata,False,2018-06-19T05:26:24Z,2019-12-04T09:07:22Z,2019-12-11T07:56:22Z,5883,264,264,Java,True,True,True,True,False,125,24,Apache License 2.0,125,24,264,master,32,1,4.0
hawkular/hawkular-alerts,Alerting subsystem for Hawkular,False,2015-01-21T19:59:08Z,2019-08-13T16:00:53Z,2019-11-04T10:35:56Z,6833,71,71,Java,True,True,True,False,False,37,10,Apache License 2.0,37,10,71,master,16,1,7.0
hawkular/hawkular-metrics,Time Series Metrics Engine based on Cassandra,False,2014-03-13T10:07:30Z,2019-12-13T09:52:33Z,2019-08-07T23:54:25Z,22153,219,219,Java,False,True,True,False,False,77,12,Apache License 2.0,77,12,219,master,38,1,7.0
herrmanntom/setlX,setlX is an interpreter for the high level programming-language SetlX (set language extended).,False,2014-12-20T18:36:35Z,2019-11-04T14:17:59Z,2019-06-16T11:32:34Z,26434,19,19,Java,True,True,True,False,False,12,0,Other,12,0,19,master,7,2,3.0
hibernate/hibernate-hql-parser,New experimental parser for JP-QL queries,False,2012-05-02T15:18:20Z,2019-12-12T03:01:04Z,2018-10-23T11:57:30Z,754,24,24,Java,False,True,True,False,False,24,0,Other,24,0,24,master,28,2,2.0
iamazy/elasticsearch-sql,parse sql into elasticsearch dsl with antlr4,False,2019-07-23T05:05:58Z,2019-12-14T09:03:15Z,2019-12-14T09:03:13Z,3259,28,28,Java,True,True,True,True,False,10,0,MIT License,10,0,28,master,2,4,12.0
icode/ameba,useful full stack RESTful framework,False,2014-01-25T13:16:56Z,2019-06-05T05:03:57Z,2018-07-14T10:27:30Z,2041,38,38,Java,True,True,True,True,False,17,47,MIT License,17,47,38,master,9,1,2.0
infraling/atomic,Software for multi-level annotation of linguistic corpora,False,2013-10-14T14:37:58Z,2018-12-10T08:49:48Z,2019-01-18T09:42:38Z,10238,17,17,Java,True,True,True,True,True,7,41,Apache License 2.0,7,41,17,development,9,1,5.0
intuit/karate,Test Automation Made Simple,False,2017-02-07T15:59:17Z,2019-12-13T19:17:06Z,2019-12-12T10:17:34Z,16775,2609,2609,Java,True,True,True,True,True,673,37,MIT License,673,37,2609,master,164,2,2.0
ivanyu/logical-rules-parser-antlr,A simple example of a parser built with ANTLR,False,2014-09-13T18:04:36Z,2019-09-18T17:26:17Z,2014-09-13T21:13:17Z,144,28,28,Java,True,False,True,False,False,16,0,MIT License,16,0,28,master,3,1,4.0
jAngBridge/ts-parser,TypeScript parser generated with ANTLR4,False,2018-05-27T17:13:07Z,2019-09-25T08:12:06Z,2018-05-27T18:02:45Z,35,14,14,Java,True,True,True,True,False,7,0,MIT License,7,0,14,master,3,3,7.0
jaeksoft/opensearchserver,Open-source Enterprise Grade Search Engine Software,False,2013-07-18T16:03:33Z,2019-12-14T00:30:28Z,2019-11-13T06:11:03Z,515572,354,354,Java,True,True,True,False,False,157,219,GNU General Public License v3.0,157,219,354,master,68,1,4.0
janyou/ANTLR-Swift-Target,ANTLR Swift Target,False,2015-12-28T12:50:57Z,2019-12-05T14:32:08Z,2017-04-29T18:24:46Z,3259,21,21,Java,True,True,True,True,False,2,2,"BSD 2-Clause ""Simplified"" License",2,2,21,master,3,1,16.0
java-decompiler/jd-gui,A standalone Java Decompiler GUI,False,2015-03-25T05:28:41Z,2019-12-14T15:45:55Z,2019-12-06T16:28:33Z,56985,7693,7693,Java,True,True,True,True,False,1546,84,GNU General Public License v3.0,1546,84,7693,master,468,1,5.0
javamonkey/beetl2.0,beetl2.0,False,2013-09-04T01:19:06Z,2019-12-10T02:48:41Z,2019-05-06T13:24:22Z,19811,388,388,Java,True,True,True,True,False,111,43,"BSD 3-Clause ""New"" or ""Revised"" License",111,43,388,master,51,2,6.0
jbclements/rust-antlr,An ANTLR grammar for Rust,False,2013-03-23T00:09:02Z,2019-09-18T13:22:40Z,2016-03-09T16:56:15Z,78,39,39,ANTLR,True,True,True,True,False,6,1,Apache License 2.0,6,1,39,master,2,4,0.0
jbotsim/JBotSim,JBotSim Core Files,False,2017-03-12T11:57:53Z,2019-11-23T16:56:00Z,2019-11-29T14:26:38Z,2838,13,13,Java,True,True,True,True,False,15,20,GNU Lesser General Public License v3.0,15,20,13,master,6,1,1.0
jcoplien/trygve,The trygve language project - Building a DCI-centric language from the ground up,False,2015-09-04T21:04:12Z,2019-11-05T03:12:33Z,2019-03-11T11:37:21Z,15909,74,74,Java,True,True,True,True,False,14,5,GNU General Public License v2.0,14,5,74,master,20,1,26.0
jdbi/jdbi,"jdbi is designed to provide convenient tabular data access in Java; including templated SQL, parameterized and strongly typed queries, and Streams integration",False,2009-06-17T16:36:36Z,2019-12-10T14:49:04Z,2019-12-05T17:04:06Z,21904,1341,1341,Java,True,True,True,False,False,261,63,Other,261,63,1341,master,76,4,7.0
jenkinsci/credentials-plugin,,False,2012-02-23T18:57:07Z,2019-12-13T16:38:48Z,2019-12-13T16:38:45Z,9671,46,46,Java,False,True,True,False,False,157,5,MIT License,157,5,46,master,127,1,1.0
jknack/handlebars.java,Logic-less and semantic Mustache templates with Java,False,2012-05-27T03:22:22Z,2019-12-10T20:12:11Z,2019-11-11T09:19:59Z,3494,1099,1099,Java,True,True,True,True,True,312,63,Other,312,63,1099,master,63,2,7.0
jkschneider/graphql-gremlin,,False,2016-04-07T19:42:21Z,2019-10-31T17:27:40Z,2016-08-27T16:52:13Z,114,27,27,Java,True,True,True,True,False,5,1,,5,1,27,master,4,1,8.0
jplag/jplag,JPlag - Detecting Software Plagiarism,False,2015-03-21T20:06:19Z,2019-12-10T13:05:21Z,2019-11-26T10:27:27Z,950,353,353,Java,True,True,True,True,False,121,24,GNU General Public License v3.0,121,24,353,master,33,2,6.0
json-template/JsonTemplate,A Java tool for generating json strings,False,2019-02-07T09:44:20Z,2019-09-18T02:41:57Z,2019-04-10T07:19:37Z,233,35,35,Java,True,True,True,True,False,6,3,Apache License 2.0,6,3,35,master,6,1,2.0
jsurfer/JsonSurfer,A streaming JsonPath processor in Java,False,2015-03-19T15:02:44Z,2019-12-03T16:32:16Z,2019-12-03T16:32:13Z,983,151,151,Java,True,True,True,True,False,31,4,MIT License,31,4,151,master,11,1,6.0
julianthome/inmemantlr,In Memory compilation of ANTLR grammars,False,2016-04-28T10:08:26Z,2019-12-09T16:36:40Z,2019-02-24T11:06:59Z,1002,59,59,Java,True,True,True,True,False,13,0,MIT License,13,0,59,master,10,16,14.0
junrushao1994/Final-Fanatic-Facility,A C compiler with SSA-based backend optimzation,False,2015-06-11T08:35:43Z,2018-07-13T17:51:50Z,2016-03-19T15:16:56Z,2201,11,11,Java,True,True,True,True,False,0,0,,0,0,11,master,1,1,7.0
jyukutyo/JVM-Math-Language,JVM Math Language with ANTLR and Graal,False,2017-07-08T05:45:24Z,2019-12-11T15:46:01Z,2019-02-27T02:37:38Z,30,12,12,Java,True,True,True,True,False,1,0,,1,0,12,master,2,1,5.0
k3po/k3po,"""I am fluent in over 6 million forms of communication!""",False,2014-04-03T22:14:18Z,2019-12-11T21:10:30Z,2019-12-11T21:10:33Z,9891,32,32,Java,True,True,True,True,False,37,70,Apache License 2.0,37,70,32,develop,23,2,4.0
kaiwaehner/ksql-fork-with-deep-learning-function,"Deep Learning UDF for KSQL, the Streaming SQL Engine for Apache Kafka with Elasticsearch Sink Example",False,2018-03-26T12:28:15Z,2019-12-06T07:45:42Z,2018-07-31T13:07:41Z,1921,53,53,Java,True,True,True,True,False,23,0,Apache License 2.0,23,0,53,master,5,1,8.0
kasonyang/kalang,A statically-typed and null-safe program language,False,2016-02-12T01:50:58Z,2019-12-14T09:11:02Z,2019-11-24T13:26:31Z,8957,46,46,Java,True,True,True,True,False,11,1,MIT License,11,1,46,master,3,2,27.0
kayler-renslow/arma-dialog-creator,A dialog/GUI creation tool for Arma 3.,False,2016-05-22T19:39:13Z,2019-11-04T16:41:44Z,2019-10-17T00:56:08Z,130807,51,51,Java,True,True,True,True,False,9,14,MIT License,9,14,51,master,23,2,11.0
kiegroup/drools,"Drools is a rule engine, DMN engine and complex event processing (CEP) engine for Java.",False,2011-02-18T08:37:05Z,2019-12-14T09:21:34Z,2019-12-13T17:47:53Z,165265,2637,2637,Java,False,True,True,False,False,1735,14,Apache License 2.0,1735,14,2637,master,277,1,45.0
kmizu/nub,A Tiny Programming Language,False,2016-12-09T23:37:04Z,2018-11-21T06:17:59Z,2017-01-24T15:17:20Z,58,26,26,Java,True,True,True,True,False,8,2,,8,2,26,master,6,1,2.0
kodokojo/kodokojo,Allow to manage Kodo Kojo project,False,2016-02-12T18:40:52Z,2019-12-05T08:02:50Z,2017-04-18T14:01:27Z,3834,48,48,Java,True,True,True,False,False,17,5,Other,17,5,48,master,7,1,1.0
konsoletyper/teavm-flavour,Framework for writing client-side applications using TeaVM,False,2015-04-19T15:41:26Z,2019-12-05T15:22:38Z,2019-11-29T17:58:00Z,1705,65,65,Java,True,True,True,True,False,13,23,Other,13,23,65,master,9,1,1.0
korpling/ANNIS,"ANNIS is an open source, versatile web browser-based search and visualization architecture for complex multilevel linguistic corpora with diverse types of annotation.",False,2012-08-17T08:03:40Z,2019-12-11T12:22:48Z,2019-12-11T12:23:01Z,182660,37,37,Java,True,True,True,False,True,25,99,Apache License 2.0,25,99,37,develop,14,4,1.0
kotlinx/ast,Generic AST parsing library for kotlin multiplatform,False,2019-09-08T11:04:39Z,2019-12-02T07:48:53Z,2019-12-02T15:12:27Z,824,27,27,Java,True,True,True,True,False,2,2,Apache License 2.0,2,2,27,master,2,6,9.0
latexdraw/latexdraw,A vector drawing editor for LaTeX (Java Swing/JavaFX).,False,2013-02-24T21:35:52Z,2019-12-12T09:00:50Z,2019-12-12T09:00:47Z,34109,263,263,Java,True,False,True,True,False,48,8,GNU General Public License v3.0,48,8,263,master,24,2,7.0
lchaboud-restlet/antlr-sqlparser,SQL Parser with ANTLR v4,False,2014-09-17T12:51:12Z,2019-11-21T08:54:10Z,2014-09-29T12:44:20Z,444,24,24,Java,True,True,True,True,False,10,1,,10,1,24,master,6,1,2.0
le-moulin-studio/java-semantic-diff,Experiment about a semantic-based diff tool for Java language.,False,2013-11-12T12:32:06Z,2019-06-25T09:22:01Z,2015-03-28T14:35:01Z,1515,14,14,ANTLR,True,True,True,True,False,1,3,GNU Affero General Public License v3.0,1,3,14,master,2,1,1.0
lealone/Bats,面向OLTP、OLAP、批处理、流处理场景的大一统SQL引擎,False,2019-07-16T07:06:19Z,2019-12-05T10:20:54Z,2019-10-23T07:31:05Z,7128,124,124,Java,True,True,True,True,False,29,6,Apache License 2.0,29,6,124,master,14,4,4.0
lensesio/kafka-connect-query-language,SQL for Kafka Connectors,False,2016-05-28T14:03:35Z,2019-12-06T09:41:47Z,2019-06-07T14:01:13Z,622,69,69,Java,True,True,True,True,False,22,6,Apache License 2.0,22,6,69,master,14,2,0.0
liferay/liferay-portal,,False,2009-09-25T22:55:58Z,2019-12-14T14:00:18Z,2019-12-14T02:32:48Z,13420926,1489,1489,Java,False,True,True,False,False,2455,17,Other,2455,17,1489,master,166,1,16.0
linkedin/Cubert,Fast and efficient batch computation engine for complex analysis and reporting of massive datasets on Hadoop,False,2014-09-28T21:20:37Z,2019-09-01T18:07:37Z,2015-08-24T23:32:06Z,2698,240,240,Java,True,True,True,False,True,63,5,Apache License 2.0,63,5,240,master,63,1,1.0
linkedin/parseq,Asynchronous Java made easier,False,2012-09-18T16:43:59Z,2019-12-13T03:19:19Z,2019-11-14T02:46:53Z,4321,938,938,Java,True,True,True,True,False,246,54,Apache License 2.0,246,54,938,master,140,1,6.0
linkedin/rest.li,"Rest.li is a REST+JSON framework for building robust, scalable service architectures using dynamic discovery and simple asynchronous APIs.",False,2012-11-30T19:37:51Z,2019-12-14T04:32:01Z,2019-12-05T21:34:30Z,19425,1999,1999,Java,True,True,True,True,True,401,27,Other,401,27,1999,master,198,2,5.0
linqs/psl,The PSL software from the University of Maryland and the University of California Santa Cruz,False,2011-07-29T20:24:30Z,2019-12-14T11:21:08Z,2019-12-06T20:58:42Z,6447,229,229,Java,True,True,True,True,False,83,46,Apache License 2.0,83,46,229,master,51,1,3.0
lmcgrath/scotch-lang,,False,2014-11-29T05:28:45Z,2019-08-13T15:56:37Z,2015-05-18T21:53:01Z,2664,13,13,Java,True,True,True,True,True,4,0,,4,0,13,master,7,2,10.0
locationtech/geowave,"GeoWave provides geospatial and temporal indexing on top of Accumulo, HBase, BigTable, Cassandra, and DynamoDB",False,2014-06-03T15:39:29Z,2019-12-12T22:19:54Z,2019-12-13T22:00:46Z,893941,363,363,Java,True,False,True,True,True,159,57,Apache License 2.0,159,57,363,master,70,1,2.0
lockss/lockss-daemon,The central repository for the LOCKSS project ,False,2016-01-13T06:06:33Z,2019-12-14T00:02:13Z,2019-12-14T00:02:11Z,1028023,18,18,Java,True,True,True,True,False,10,4,Other,10,4,18,master,20,4,4.0
logic-ng/LogicNG,The Next Generation Logic Library,False,2015-10-29T09:04:40Z,2019-11-25T15:00:32Z,2019-11-19T10:45:30Z,5543,33,33,Java,True,True,True,True,False,8,3,Apache License 2.0,8,3,33,master,8,2,5.0
marcelganczak/swift-js-transpiler,Swift 3 to JavaScript/TypeScript/Java Transpiler. Built with antlr4. With live preview.,False,2016-12-18T17:01:55Z,2019-12-03T20:14:36Z,2018-03-22T14:39:55Z,6047,40,40,Java,True,True,True,True,False,5,2,MIT License,5,2,40,master,3,2,20.0
maskarade/Android-Orma,An ORM for Android with type-safety and painless smart migrations,False,2015-11-09T00:26:20Z,2019-12-07T14:10:30Z,2018-12-03T12:55:31Z,3823,439,439,Java,True,True,True,False,True,49,23,Other,49,23,439,master,32,1,2.0
melin/bigdata-sql-parser,"基于antlr4 解析器，支持spark sql, tidb sql, flink sql, Spark/flink jar 运行命令解析器",False,2018-07-12T01:28:59Z,2019-12-13T09:39:50Z,2019-11-26T10:17:42Z,789,32,32,Java,True,True,True,True,False,15,0,,15,0,32,master,8,6,25.0
meridor/perspective-backend,Scalable multi-cloud management API and shell,False,2015-03-22T20:11:00Z,2019-05-26T02:42:49Z,2017-02-28T04:53:39Z,2264,13,13,Java,True,True,True,True,False,5,42,Apache License 2.0,5,42,13,master,2,4,3.0
merrymercy/compiler2017,"A compiler for the course Compiler 2017 at ACM Class, SJTU.  ",False,2017-06-22T03:36:06Z,2019-12-12T05:40:26Z,2018-05-26T18:07:59Z,3241,48,48,Java,True,True,True,True,False,10,1,,10,1,48,master,5,1,8.0
metadave/contact,Contact is a language and interactive shell for Riak.,False,2013-02-12T21:01:22Z,2017-07-19T19:42:30Z,2014-01-01T14:55:47Z,9770,15,15,Java,True,True,True,True,True,1,0,Apache License 2.0,1,0,15,master,5,1,9.0
metadave/etp,An Erlang Term Parser for Java,False,2013-04-18T15:23:08Z,2019-04-12T07:32:34Z,2018-05-04T21:01:20Z,1236,14,14,Java,True,True,True,True,True,4,0,,4,0,14,master,2,1,7.0
michel-kraemer/citeproc-java, A Citation Style Language (CSL) processor for Java.,False,2013-09-06T17:54:04Z,2019-12-14T11:25:17Z,2019-12-14T11:25:14Z,2524,57,57,Java,True,False,True,False,True,13,1,Apache License 2.0,13,1,57,master,6,2,2.0
mike-lischke/vscode-antlr4,ANTLR4 language support for Visual Studio Code,False,2016-09-07T13:49:30Z,2019-12-10T00:33:50Z,2019-11-27T14:32:01Z,18338,131,131,ANTLR,True,False,True,False,False,17,13,MIT License,17,13,131,master,12,14,0.0
mir1128/kafkasql,,False,2019-06-04T13:43:53Z,2019-07-18T11:39:18Z,2019-06-21T02:20:06Z,591,13,13,Java,True,True,True,True,False,2,0,Apache License 2.0,2,0,13,master,2,1,18.0
mjwrites/Cafecito,,False,2017-10-14T00:44:42Z,2018-09-19T03:54:15Z,2017-10-27T04:00:15Z,41711,16,16,Java,True,True,True,True,False,9,0,,9,0,16,master,3,1,10.0
mozafari/cliffguard,WorkloadMiner + CliffGuard (Robust Physical Designer for Databases),False,2015-03-10T18:41:52Z,2019-03-08T07:04:39Z,2017-01-23T16:23:58Z,73063,25,25,Java,True,True,True,True,False,5,0,,5,0,25,master,6,2,2.0
mrc-ide/PhyDyn,PhyDyn: Epidemiological modelling in BEAST,False,2017-07-25T16:42:37Z,2019-08-23T16:50:32Z,2019-08-23T16:55:32Z,150495,12,12,Java,True,True,True,True,False,6,2,GNU General Public License v3.0,6,2,12,master,4,2,15.0
multilang-depends/depends,"Depends is a fast, comprehensive code dependency analysis tool",False,2019-02-10T08:08:28Z,2019-12-12T02:01:33Z,2019-12-12T02:01:31Z,31299,53,53,Java,True,True,True,True,False,22,4,MIT License,22,4,53,master,11,11,14.0
mzur/pretty-formula,A small Java library to parse mathematical formulas to LaTeX and display them as images,False,2014-12-04T15:55:44Z,2019-12-11T18:09:34Z,2014-12-04T16:59:41Z,4684,25,25,Java,True,True,True,False,False,8,0,MIT License,8,0,25,master,2,1,8.0
nRo/DataFrame,DataFrame Library for Java,False,2016-03-11T21:32:37Z,2019-12-12T12:11:22Z,2019-08-21T11:23:44Z,756,24,24,Java,True,True,True,True,False,6,0,MIT License,6,0,24,master,5,1,2.0
ndsev/zserio,"zero sugar, zero fat, zero serialization overhead",False,2018-07-19T08:44:23Z,2019-12-13T13:44:24Z,2019-12-13T13:44:21Z,20004,16,16,Java,True,False,True,False,True,8,61,"BSD 3-Clause ""New"" or ""Revised"" License",8,61,16,master,13,3,11.0
nedap/archie,"OpenEHR library implementing ADL 2, AOM 2 and RM 1.0.4",False,2015-10-15T13:16:16Z,2019-07-11T12:56:06Z,2019-07-11T12:55:51Z,25656,12,12,Java,True,True,True,True,False,13,0,Apache License 2.0,13,0,12,master,11,10,8.0
neo4j-contrib/neo4j-apoc-procedures,"Awesome Procedures On Cypher for Neo4j 3.x - codenamed ""apoc""                     If you like it, please ★ above ⇧            ",False,2016-02-25T08:33:37Z,2019-12-13T13:13:33Z,2019-12-13T11:59:09Z,24151,1032,1032,Java,True,True,True,False,True,259,294,Apache License 2.0,259,294,1032,3.5,72,1,1.0
nielsbasjes/logparser,"Easy parsing of Apache HTTPD and NGINX access logs with Java, Hadoop, Hive, Pig, Flink, Beam, Storm, ...",False,2013-09-06T19:48:43Z,2019-11-28T15:39:03Z,2019-11-28T15:39:01Z,2086,81,81,Java,True,True,True,True,True,27,1,Apache License 2.0,27,1,81,master,6,1,1.0
nielsbasjes/yauaa,Yet Another UserAgent Analyzer,False,2016-07-04T14:51:04Z,2019-12-13T11:42:36Z,2019-12-13T11:42:33Z,10930,339,339,Java,True,True,True,False,True,68,3,Apache License 2.0,68,3,339,master,32,2,45.0
notaql/notaql,A cross-system data transformation language. ,False,2015-05-18T11:45:00Z,2019-03-19T12:36:57Z,2015-07-20T15:16:00Z,461,11,11,Java,True,True,True,True,False,3,13,Apache License 2.0,3,13,11,master,3,10,28.0
novoda/sqlite-analyzer,Code generation for Java/Android database access.,False,2014-01-17T16:27:22Z,2019-11-21T09:10:06Z,2018-02-07T15:12:30Z,4799,64,64,Java,True,True,True,True,True,7,7,Other,7,7,64,master,58,1,1.0
npgall/cqengine,Ultra-fast SQL-like queries on Java collections,False,2015-08-23T19:27:00Z,2019-12-13T02:47:34Z,2019-11-26T23:31:05Z,10790,1098,1098,Java,True,True,False,False,False,173,43,Apache License 2.0,173,43,1098,master,77,4,6.0
nradov/abnffuzzer,Java fuzz testing library for implementations of ABNF rules such as IETF RFCs,False,2016-02-22T02:58:30Z,2019-12-07T06:08:57Z,2019-12-07T06:08:55Z,1149,26,26,Java,True,True,True,True,True,3,1,GNU Lesser General Public License v2.1,3,1,26,master,4,1,3.0
nsacyber/GRASSMARLIN,Provides situational awareness of Industrial Control Systems (ICS) and Supervisory Control and Data Acquisition (SCADA) networks in support of network security assessments. #nsacyber,False,2015-12-14T16:15:24Z,2019-12-12T08:40:48Z,2018-03-09T18:32:10Z,34984,504,504,Java,True,True,True,True,False,189,22,Other,189,22,504,master,85,1,1.0
oasis-open/cti-stix2-json-schemas,OASIS TC Open Repository: Non-normative schemas and examples for STIX 2,False,2016-09-01T18:32:10Z,2019-12-09T14:28:38Z,2019-12-09T14:36:53Z,411,46,46,ANTLR,True,True,True,True,False,35,4,"BSD 3-Clause ""New"" or ""Revised"" License",35,4,46,master,17,1,0.0
octopus-platform/joern,"A robust parser for C/C++ storing abstract syntax trees, control flow graphs and program dependence graphs in a neo4j graph database.",False,2013-05-02T22:44:29Z,2019-12-10T04:18:34Z,2019-05-10T12:42:53Z,23415,459,459,Java,True,True,True,False,False,119,44,GNU Lesser General Public License v3.0,119,44,459,dev,52,8,41.0
